{
  "testId": "TC-202",
  "title": "Testing page lists the expected columns",
  "source": "csv",
  "app": "meiden",
  "priority": "medium",
  "preconditions": [
    "User is signed in"
  ],
  "steps": [
    "Open the Testing page"
  ],
  "testData": {},
  "expected": [
    {
      "description": "The 'All Breakers in Testing' heading is visible and the table shows columns Production Order, Breaker Type, Control Voltage, Current Rating, Customer Name, Testing Status"
    }
  ],
  "tags": [],
  "needsClarification": false
}
