{
  "testId": "PR-001",
  "title": "Verify that an unauthenticated user sees the Sign in with Microsoft button on the login page",
  "source": "prompt",
  "app": "meiden",
  "priority": "medium",
  "preconditions": [
    "User is not signed in"
  ],
  "steps": [
    "Open the login page"
  ],
  "testData": {},
  "expected": [
    {
      "description": "The Welcome Back heading is visible"
    },
    {
      "description": "The Sign in with Microsoft button is visible and enabled"
    }
  ],
  "tags": [
    "login",
    "unauthenticated"
  ],
  "needsClarification": false
}
