{
  "testId": "TC-207",
  "title": "Settings lists its configuration sections",
  "source": "csv",
  "app": "meiden",
  "priority": "medium",
  "preconditions": [
    "User is signed in"
  ],
  "steps": [
    "Open the Settings page"
  ],
  "testData": {},
  "expected": [
    {
      "description": "The Settings menu shows User Management, Roles and Permissions, Assembly Configuration and Testing Configuration"
    }
  ],
  "tags": [],
  "needsClarification": false
}
