{
  "testId": "TC-201",
  "title": "Assembly page lists the expected columns",
  "source": "csv",
  "app": "meiden",
  "priority": "medium",
  "preconditions": [
    "User is signed in"
  ],
  "steps": [
    "Open the Assembly page"
  ],
  "testData": {},
  "expected": [
    {
      "description": "The 'All Breakers in Assembly' heading is visible and the table shows columns Production Order, Breaker Type, Current Rating, Control Voltage, Customer, Status"
    }
  ],
  "tags": [],
  "needsClarification": false
}
