{
  "testId": "TC-002",
  "title": "Login fails with an invalid password",
  "source": "csv",
  "app": "app",
  "priority": "medium",
  "preconditions": [
    "User is on the login page"
  ],
  "steps": [
    "Enter a valid username",
    "Enter an invalid password",
    "Click Login"
  ],
  "testData": {
    "username": "demo_user",
    "password": "wrong_password"
  },
  "expected": [
    {
      "description": "An error message 'Invalid username or password' is displayed"
    },
    {
      "description": "The user stays on the login page"
    }
  ],
  "tags": [],
  "needsClarification": false
}
