{
  "testId": "PR-002",
  "title": "Verify that the Settings page shows the Users section with a search box and an Add New User button",
  "source": "prompt",
  "app": "meiden",
  "priority": "medium",
  "preconditions": [
    "User is signed in"
  ],
  "steps": [
    "Open the Settings page"
  ],
  "testData": {},
  "expected": [
    {
      "description": "The Users section heading is visible"
    },
    {
      "description": "A Search users box is visible"
    },
    {
      "description": "An Add New User button is visible"
    }
  ],
  "tags": [
    "settings"
  ],
  "needsClarification": false
}
