{
  "testId": "PR-004",
  "title": "Verify that the Production Orders page has a Create New Order button",
  "source": "prompt",
  "app": "meiden",
  "priority": "medium",
  "preconditions": [
    "The user is signed in"
  ],
  "steps": [
    "Open the Production Orders page"
  ],
  "testData": {},
  "expected": [
    {
      "description": "A button named Create New Order is visible"
    }
  ],
  "tags": [],
  "needsLlmNormalization": false
}
