{
  "testId": "TC-003",
  "title": "Login with an empty username shows a validation error",
  "source": "csv",
  "app": "app",
  "priority": "medium",
  "preconditions": [
    "User is on the login page"
  ],
  "steps": [
    "Leave the username empty",
    "Enter a password",
    "Click Login"
  ],
  "testData": {
    "password": "Passw0rd!"
  },
  "expected": [
    {
      "description": "An error message 'Username is required' is displayed"
    }
  ],
  "tags": [],
  "needsClarification": false
}
