{
  "testId": "TC-205",
  "title": "Create New Order dialog can be closed",
  "source": "csv",
  "app": "meiden",
  "priority": "medium",
  "preconditions": [
    "User is signed in"
  ],
  "steps": [
    "Open the Production Orders page",
    "Click 'Create New Order'",
    "Click Close in the dialog"
  ],
  "testData": {},
  "expected": [
    {
      "description": "The 'Create New Production Order' dialog is no longer visible"
    }
  ],
  "tags": [],
  "needsClarification": false
}
